{
  "event_id": "evt-redacted-001",
  "session_id": "session-synthetic-001",
  "turn_id": "turn-0001",
  "sequence_no": 8,
  "actor_role": "user",
  "message_id": "message-user-001",
  "persona_id": "persona-synthetic-001",
  "relationship_id": "relationship-synthetic-001",
  "provider": "synthetic-provider",
  "model": "synthetic-model",
  "observed_at": "2026-08-17T16:03:00+02:00",
  "created_at": "2026-08-17T16:03:00+02:00",
  "content_type": "application/json",
  "content_payload": {
    "message": "Synthetic credential field was visible and redacted before persistence.",
    "api_key": "[SECRET_REDACTED]"
  },
  "status": "complete",
  "source_ref": {
    "source_kind": "owned_client",
    "observation_type": "observed",
    "source_id": "owned-redacted-001",
    "uri": null,
    "adapter_version": "phase0-synthetic"
  },
  "attachment_ref": [],
  "correction_id": null,
  "correction_of": null,
  "redaction_state": "redacted",
  "metadata": {
    "adapter": "A019",
    "adapter_version": "phase0-synthetic",
    "ingest_id": "ingest-008",
    "knowledge": {},
    "extensions": {}
  }
}
