{
  "event_id": "evt-sidecar-001",
  "session_id": "session-synthetic-001",
  "turn_id": "turn-0001",
  "sequence_no": 3,
  "actor_role": "assistant",
  "message_id": "message-sidecar-001",
  "persona_id": "persona-synthetic-001",
  "relationship_id": "relationship-synthetic-001",
  "provider": "synthetic-provider",
  "model": "synthetic-model",
  "observed_at": "2026-08-17T16:01:00+02:00",
  "created_at": "2026-08-17T16:01:01+02:00",
  "content_type": "application/vnd.companion-mind.multimodal+json",
  "content_payload": [
    {
      "type": "text",
      "text": "Synthetic image description."
    },
    {
      "type": "image_ref",
      "attachment_id": "attachment-synthetic-001"
    }
  ],
  "status": "complete",
  "source_ref": {
    "source_kind": "browser_sidecar",
    "observation_type": "observed",
    "source_id": "sidecar-capture-001",
    "uri": "https://example.invalid/synthetic-source",
    "adapter_version": "phase0-synthetic"
  },
  "attachment_ref": [
    {
      "attachment_id": "attachment-synthetic-001",
      "media_type": "image/png",
      "source_ref": "sidecar-media-001",
      "sha256": "0000000000000000000000000000000000000000000000000000000000000000"
    }
  ],
  "correction_id": null,
  "correction_of": null,
  "redaction_state": "none",
  "metadata": {
    "adapter": "A018",
    "adapter_version": "phase0-synthetic",
    "ingest_id": "ingest-003",
    "knowledge": {},
    "extensions": {}
  }
}
